{
  "schema_version": "1.0",
  "run_id": "run_example-match-101",
  "application_id": "app_example-support-101",
  "role": "MATCHER",
  "issued_at": "2099-01-01T00:00:00Z",
  "expires_at": "2099-01-01T00:15:00Z",
  "input_refs": [
    "job_example-support-101",
    "facts_example-support-101"
  ],
  "input_digests": [
    "aaaaaaaaaaaaaaaaaaaaaaaaaaaaaaaaaaaaaaaaaaaaaaaaaaaaaaaaaaaaaaaa",
    "bbbbbbbbbbbbbbbbbbbbbbbbbbbbbbbbbbbbbbbbbbbbbbbbbbbbbbbbbbbbbbbb"
  ],
  "permitted_fact_ids": [
    "fact_support-years",
    "fact_python"
  ],
  "capabilities": [
    "READ_PUBLIC",
    "READ_MINIMIZED_FACTS",
    "DRAFT_STRUCTURED"
  ],
  "task_digest": "494c598e57dce4cb57a635e41c29f6e5b4249aac37dd114e4467ea4e66ea1aab"
}
